Artmetic Multiplication, PASS, 3991680, 2, 3, 4, 5, 66, 7, 8, 9
Arithmetic Addition, PASS, 123.000000, 2,  5,  9,  12,  13,  14,  15,  16,  18,  19
Artmetic Multiplication, FAIL, invalid stod argument, 2, 3, 4ad, ss5, 66, 7, 8, 9
Arithmetic Addition, FAIL, invalid stod argument, 2,  5,  9,  dss12,  13,  14,  15,  16,  18,  19
Matrix Addition, PASS, 10 10 10; 10 10 10; 10 10 10, 1 2 3; 4 5 6; 7 8 9,  9 8 7; 6 5 4; 3 2 1;
Matrix Addition, FAIL, Provided data not correct, 1 2 3; 4 ; 7 8 9,  9 8 7; 6 5 4; 3 2 1;
Matrix Addition, FAIL, Matrixes sizes are not equal, 1 2 3; 4 5 6; 7 8 9,  9 8 7; 6 5 4; 3 2 1; 3 2 1;
